{
  "schema": "afo.site.bundle",
  "schema_version": "1.0.0",
  "bundle_id": "550e8400-e29b-41d4-a716-446655440000",
  "bundle_type": "micro_seo_site",
  "status": "generated",
  "created_at": "2026-06-02T00:00:00Z",
  "updated_at": "2026-06-02T00:00:00Z",
  "build_intent": "Create a small AI-readable local business website that supports local search discovery.",
  "client": {
    "name": "Example Business",
    "industry": "Home Services",
    "location": "San Juan Capistrano, CA",
    "contact_email": "owner@example.com"
  },
  "site": {
    "base_url": "https://example-business.com",
    "domain": "example-business.com",
    "title": "Example Business - Local Services",
    "description": "Local service website example for AFO Site Bundle Manifest v1.",
    "language": "en"
  },
  "content": {
    "services": ["Service one", "Service two"],
    "pages": [
      {
        "slug": "/",
        "title": "Home",
        "meta_description": "Example local service website.",
        "sections": [
          {
            "type": "hero",
            "headline": "Example Business Local Service Website",
            "body": "A preview-safe reference website for the AFO Site Bundle contract.",
            "cta_label": "Contact",
            "cta_url": "/contact"
          }
        ]
      }
    ],
    "articles": [],
    "faqs": [],
    "calls_to_action": []
  },
  "discovery": {
    "llms_txt": "# Example Business\n\nPreview-safe reference website for AFO Site Bundle Manifest v1.\n",
    "robots_txt": "User-agent: *\nAllow: /\nSitemap: https://example-business.com/sitemap.xml\n",
    "sitemap_xml": "<?xml version=\"1.0\" encoding=\"UTF-8\"?>\n<urlset xmlns=\"http://www.sitemaps.org/schemas/sitemap/0.9\">\n  <url><loc>https://example-business.com/</loc></url>\n</urlset>\n",
    "canonical_url": "https://example-business.com"
  },
  "schema_jsonld": {
    "@context": "https://schema.org",
    "@type": "LocalBusiness",
    "name": "Example Business",
    "url": "https://example-business.com"
  },
  "worker": {
    "name": "example-business-afo",
    "entry_point": "src/index.ts",
    "compatibility_date": "2026-06-01",
    "routes": [],
    "bindings": {}
  },
  "repo": {
    "owner": "nothinginfinity",
    "repo": "afo-site-bundle-contract",
    "branch": "main",
    "worker_path": "examples/example-business/worker",
    "bundle_path": "examples/example-business/afo.site.bundle.json",
    "receipts_path": "receipts",
    "handoff_path": "docs/mcp-handoff.md"
  },
  "validation": { "passed": false, "validated_at": null, "validated_by": null, "checks": [], "errors": [], "warnings": [] },
  "deployment": {
    "deploy_mode": "preview_first",
    "confirmed": false,
    "environment": "preview",
    "preview_url": "",
    "production_url": "",
    "last_deploy": null,
    "deploy_receipts": []
  },
  "smoke_tests": {
    "routes": [
      { "path": "/", "expect_status": 200, "expect_contains": "Example Business" },
      { "path": "/health", "expect_status": 200, "expect_contains": "ok" },
      { "path": "/llms.txt", "expect_status": 200, "expect_contains": "Example Business" },
      { "path": "/robots.txt", "expect_status": 200, "expect_contains": "User-agent" },
      { "path": "/sitemap.xml", "expect_status": 200, "expect_contains": "urlset" },
      { "path": "/schema.json", "expect_status": 200, "expect_contains": "LocalBusiness" }
    ],
    "last_smoke_test": null
  },
  "registry": { "registered": false, "registered_at": null, "tags": ["micro-seo-site", "local-business"] },
  "handoff": {
    "created_by": "afo-micro-seo-site-builder-mcp",
    "last_updated_by": "chatgpt-github-mcp",
    "next_action": "validate_worker",
    "next_agent": "afo-mobile-terminal-mcp",
    "notes": "Bundle is generated and preview-safe. Validate before deployment."
  }
}
