{
  "schema": "afo.site.bundle",
  "schema_version": "1.0.0",
  "bundle_id": "sample-restaurant-v005-afo-bundle",
  "bundle_type": "micro_seo_site",
  "status": "generated",
  "created_at": "2026-06-03T00:00:00Z",
  "updated_at": "2026-06-03T00:00:00Z",
  "build_intent": "Create Restaurant v0.05 as a conversion-focused content engine with sticky CTA, menu.json, deep schema, testimonials, accessibility, and A/B dark preview.",
  "client": {
    "name": "Sample Restaurant v0.05",
    "industry": "Restaurant",
    "location": "San Juan Capistrano, CA",
    "contact_email": "owner@sample-restaurant-v005.example"
  },
  "site": {
    "base_url": "https://sample-restaurant-v005.example",
    "domain": "sample-restaurant-v005.example",
    "title": "Sample Restaurant v0.05 - Conversion Content Engine",
    "description": "Restaurant v0.05 adds sticky conversion CTA, deeper menu schema, testimonials, accessibility, menu.json discovery, and A/B preview modes.",
    "language": "en"
  },
  "content": {
    "registry_files": [
      "examples/sample-restaurant-v005/content/menu-sections.json",
      "examples/sample-restaurant-v005/content/menu-items.json",
      "examples/sample-restaurant-v005/content/testimonials.json",
      "examples/sample-restaurant-v005/content/articles.json"
    ],
    "generated_route_patterns": [
      "/menu",
      "/menu?variant=dark",
      "/menu.json",
      "/menu.md",
      "/registry.json",
      "/items/{id}",
      "/items/{id}?format=md",
      "/menu/{section}/{slug}",
      "/menu/{section}/{slug}.md",
      "/articles/{slug}"
    ],
    "schema_types": ["Restaurant", "Menu", "MenuSection", "MenuItem", "Offer", "Review"],
    "conversion": {
      "sticky_cta_label": "Menu/Reserve/Event",
      "future_chatbot_hook": "D1 knowledge base chat"
    },
    "accessibility": ["ARIA tab roles", "labeled testimonials", "alt text", "lazy images"],
    "performance": ["webp image parameters", "lazy loading", "decoding async"]
  },
  "discovery": {
    "llms_txt": "# Sample Restaurant v0.05\n\nConversion-focused content engine with menu.json, deep schema, testimonials, and sticky CTA.\n",
    "robots_txt": "User-agent: *\nAllow: /\nSitemap: https://sample-restaurant-v005.example/sitemap.xml\n",
    "canonical_url": "https://sample-restaurant-v005.example"
  },
  "schema_jsonld": {
    "@context": "https://schema.org",
    "@type": "Restaurant",
    "name": "Sample Restaurant v0.05",
    "url": "https://sample-restaurant-v005.example",
    "description": "Restaurant v0.05 adds sticky conversion CTA, deeper menu schema, testimonials, accessibility, menu.json discovery, and A/B preview modes.",
    "servesCuisine": "California Coastal"
  },
  "worker": {
    "name": "sample-restaurant-v005-afo",
    "entry_point": "src/index.ts",
    "compatibility_date": "2026-06-01",
    "routes": [],
    "bindings": {}
  },
  "repo": {
    "owner": "nothinginfinity",
    "repo": "afo-site-bundle-contract",
    "branch": "main",
    "worker_path": "examples/sample-restaurant-v005/worker",
    "bundle_path": "examples/sample-restaurant-v005/afo.site.bundle.json",
    "receipts_path": "receipts"
  },
  "validation": { "passed": false, "validated_at": null, "validated_by": null, "checks": [], "errors": [], "warnings": [] },
  "deployment": {
    "deploy_mode": "preview_first",
    "confirmed": false,
    "environment": "preview",
    "preview_url": "",
    "production_url": "",
    "last_deploy": null,
    "deploy_receipts": []
  },
  "smoke_tests": {
    "routes": [
      { "path": "/", "expect_status": 200, "expect_contains": "Sample Restaurant v0.05" },
      { "path": "/menu", "expect_status": 200, "expect_contains": "Menu/Reserve/Event" },
      { "path": "/menu?variant=dark", "expect_status": 200, "expect_contains": "Dark A/B preview" },
      { "path": "/menu.json", "expect_status": 200, "expect_contains": "sections" },
      { "path": "/schema.json", "expect_status": 200, "expect_contains": "MenuItem" },
      { "path": "/items/101", "expect_status": 200, "expect_contains": "Seared Scallops" },
      { "path": "/health", "expect_status": 200, "expect_contains": "ok" },
      { "path": "/llms.txt", "expect_status": 200, "expect_contains": "Menu/Reserve/Event" }
    ],
    "last_smoke_test": null
  },
  "registry": { "registered": false, "registered_at": null, "tags": ["micro-seo-site", "restaurant", "restaurant-v005", "conversion-engine", "menu-json", "schema-depth"] },
  "handoff": {
    "created_by": "chatgpt-restaurant-v005-builder",
    "last_updated_by": "chatgpt-github-mcp",
    "next_action": "validate_then_preview_deploy",
    "next_agent": "afo-mobile-terminal-mcp",
    "notes": "Restaurant v0.05 conversion content engine bundle is generated and preview-safe."
  }
}
