{
  "schema": "afo.site.bundle",
  "schema_version": "1.0.0",
  "bundle_id": "sample-restaurant-v003-afo-bundle",
  "bundle_type": "micro_seo_site",
  "status": "generated",
  "created_at": "2026-06-03T00:00:00Z",
  "updated_at": "2026-06-03T00:00:00Z",
  "build_intent": "Create a visual-first Restaurant v0.03 preview demo with real photo backgrounds, menu tabs, event packages, and gallery snippet.",
  "client": {
    "name": "Sample Restaurant v0.03",
    "industry": "Restaurant",
    "location": "San Juan Capistrano, CA",
    "contact_email": "owner@sample-restaurant-v003.example"
  },
  "site": {
    "base_url": "https://sample-restaurant-v003.example",
    "domain": "sample-restaurant-v003.example",
    "title": "Sample Restaurant v0.03 - Visual Restaurant Demo",
    "description": "A visual-first, preview-safe restaurant demo with real photo backgrounds, menu tabs, event packages, and a gallery snippet.",
    "language": "en"
  },
  "content": {
    "services": ["California coastal dining", "Private event packages", "Seasonal tasting menus", "Visual restaurant demo"],
    "pages": [
      {
        "slug": "/",
        "title": "Home",
        "meta_description": "Visual-first preview-safe restaurant demo with real image capability.",
        "sections": [
          { "type": "photo_hero", "headline": "California coastal dining with real image energy." },
          { "type": "menu_tabs", "tabs": ["starters", "mains", "desserts"] },
          { "type": "events_packages", "headline": "Make private dining pop." },
          { "type": "image_gallery", "headline": "Visual proof." }
        ]
      }
    ],
    "articles": [
      {
        "slug": "/articles/photo-forward-restaurant-demo",
        "title": "Photo-Forward Restaurant Demo",
        "summary": "Restaurant v0.03 proves that preview-safe demos can include real image capability."
      }
    ],
    "faqs": [
      {
        "question": "What changed in Restaurant v0.03?",
        "answer": "v0.03 adds a real photo hero, gallery snippet, menu tabs, event packages, and sticky CTA."
      }
    ],
    "calls_to_action": [
      { "label": "Reserve preview", "url": "https://sample-restaurant-v003.example/reserve" }
    ]
  },
  "discovery": {
    "llms_txt": "# Sample Restaurant v0.03\n\nA visual-first preview-safe restaurant demo.\n",
    "robots_txt": "User-agent: *\nAllow: /\nSitemap: https://sample-restaurant-v003.example/sitemap.xml\n",
    "sitemap_xml": "<?xml version=\"1.0\" encoding=\"UTF-8\"?>\n<urlset xmlns=\"http://www.sitemaps.org/schemas/sitemap/0.9\">\n  <url><loc>https://sample-restaurant-v003.example/</loc></url>\n</urlset>\n",
    "canonical_url": "https://sample-restaurant-v003.example"
  },
  "schema_jsonld": {
    "@context": "https://schema.org",
    "@type": "Restaurant",
    "name": "Sample Restaurant v0.03",
    "url": "https://sample-restaurant-v003.example",
    "description": "A visual-first, preview-safe restaurant demo with real photo backgrounds, menu tabs, event packages, and a gallery snippet.",
    "servesCuisine": "California Coastal"
  },
  "worker": {
    "name": "sample-restaurant-v003-afo",
    "entry_point": "src/index.ts",
    "compatibility_date": "2026-06-01",
    "routes": [],
    "bindings": {}
  },
  "repo": {
    "owner": "nothinginfinity",
    "repo": "afo-site-bundle-contract",
    "branch": "main",
    "worker_path": "examples/sample-restaurant-v003/worker",
    "bundle_path": "examples/sample-restaurant-v003/afo.site.bundle.json",
    "receipts_path": "receipts"
  },
  "validation": { "passed": false, "validated_at": null, "validated_by": null, "checks": [], "errors": [], "warnings": [] },
  "deployment": {
    "deploy_mode": "preview_first",
    "confirmed": false,
    "environment": "preview",
    "preview_url": "",
    "production_url": "",
    "last_deploy": null,
    "deploy_receipts": []
  },
  "smoke_tests": {
    "routes": [
      { "path": "/", "expect_status": 200, "expect_contains": "Sample Restaurant v0.03" },
      { "path": "/health", "expect_status": 200, "expect_contains": "ok" },
      { "path": "/llms.txt", "expect_status": 200, "expect_contains": "Sample Restaurant v0.03" },
      { "path": "/robots.txt", "expect_status": 200, "expect_contains": "User-agent" },
      { "path": "/sitemap.xml", "expect_status": 200, "expect_contains": "urlset" },
      { "path": "/schema.json", "expect_status": 200, "expect_contains": "Restaurant" }
    ],
    "last_smoke_test": null
  },
  "registry": { "registered": false, "registered_at": null, "tags": ["micro-seo-site", "restaurant", "restaurant-v003", "visual-demo"] },
  "handoff": {
    "created_by": "chatgpt-restaurant-v003-builder",
    "last_updated_by": "chatgpt-github-mcp",
    "next_action": "validate_then_preview_deploy",
    "next_agent": "afo-mobile-terminal-mcp",
    "notes": "Restaurant v0.03 visual demo bundle is generated and preview-safe."
  }
}
